{
  "openbrick": "1.0",
  "kind": "standard",
  "version": "1.0.0",
  "license": "CC0-1.0",
  "credit": { "author": "OpenBrick3D contributors", "url": "https://github.com/NeuralDEEPnet/openBrick" },
  "ldu_mm": 0.4,
  "notes": "Nominal design values for brick-compatible parts. Everything derives from the module M = 8.0 mm and the stud diameter 4.8 mm (US patent 3,005,282 tangency). Print targets are starting values; fit profiles override them. See docs/plan/04-brick-geometry-spec.md.",
  "features": [
    { "id": "module", "name": "Module (stud pitch)", "nominal_mm": 8.0, "ldraw_ldu": 20, "print_target": { "fdm-0.4": "7.98 to 8.02" }, "confidence": "verified", "note": "measured 7.986 +/- 0.002 mm at 25 C", "source": "LUGNET / Munafo measurement; Cailliau" },
    { "id": "brick_height", "name": "Brick height without studs", "nominal_mm": 9.6, "ldraw_ldu": 24, "confidence": "verified", "note": "measured 9.582; three plates", "source": "Cailliau; LDraw spec" },
    { "id": "plate_height", "name": "Plate height", "nominal_mm": 3.2, "ldraw_ldu": 8, "print_target": { "fdm-0.4": "3.18 to 3.22" }, "confidence": "verified", "note": "measured 3.194; five plates equal two studs", "source": "Cailliau; LDraw spec" },
    { "id": "half_plate", "name": "Half-plate (bracket arm)", "nominal_mm": 1.6, "ldraw_ldu": 4, "confidence": "likely", "note": "neck brackets about 3 LDU", "source": "LDraw primitives" },
    { "id": "half_stud", "name": "Half-stud (jumper) offset", "nominal_mm": 4.0, "ldraw_ldu": 10, "confidence": "verified", "source": "LDraw spec" },
    { "id": "stud_diameter", "name": "Stud diameter", "nominal_mm": 4.8, "ldraw_ldu": 12, "print_target": { "fdm-0.4": "4.75 to 4.85 printed; coupon sweeps 4.60 to 4.95" }, "confidence": "verified", "note": "4.87 to 4.90 measured on genuine parts (clutch interference)", "source": "Cailliau; Lemes 2019 CMM study; cfinke/LEGO.scad" },
    { "id": "stud_height", "name": "Stud height", "nominal_mm": 1.7, "ldraw_ldu": 4, "confidence": "likely", "note": "1.6 to 1.8 by source; LDraw models 4 LDU = 1.6 mm", "source": "Cailliau 1.8; LUGNET 1.7; LEGO.scad 1.8" },
    { "id": "undersize_per_side", "name": "Horizontal undersize per side", "nominal_mm": 0.1, "ldraw_ldu": 0.25, "confidence": "verified", "note": "1x1 body is 7.8 mm; n studs = 8n - 0.2 mm; no vertical undersize", "source": "Cailliau; micrometer survey" },
    { "id": "side_wall", "name": "Side wall thickness", "nominal_mm": 1.2, "ldraw_ldu": 3, "print_target": { "fdm-0.4": "0.8 or 1.2 (line-width multiples); rib depth = 1.5 - printed wall" }, "confidence": "likely", "note": "plus 0.3 mm ribs; older references give 1.5 = wall + rib", "source": "cfinke/LEGO.scad; LUGNET" },
    { "id": "rib_depth", "name": "Internal wall rib depth", "nominal_mm": 0.3, "ldraw_ldu": 0.75, "print_target": { "fdm-0.4": "0.2 to 0.5 by coupon pocket row" }, "confidence": "likely", "note": "ribs engage the stud side; with 0.8 mm printed walls use about 0.7", "source": "cfinke/LEGO.scad 0.27 x 0.7 splines; community measurement 0.3" },
    { "id": "roof", "name": "Roof (top) thickness", "nominal_mm": 1.0, "ldraw_ldu": 2.5, "print_target": { "fdm-0.4": "at least 1.0" }, "confidence": "likely", "note": "cavity depth brick about 8.6, plate about 2.2", "source": "cfinke/LEGO.scad; PELA Blocks" },
    { "id": "baseplate_thickness", "name": "Baseplate thickness", "nominal_mm": 1.3, "ldraw_ldu": 3.25, "confidence": "inferred", "note": "thin plates without tubes; verify by measurement", "source": "cfinke/LEGO.scad" },
    { "id": "tube_outer_diameter", "name": "Underside tube outer diameter (2-wide)", "nominal_mm": 6.514, "ldraw_ldu": 16.3, "print_target": { "fdm-0.4": "6.40 to 6.65 by coupon pocket row; fit-critical" }, "confidence": "verified", "note": "8 sqrt2 - 4.8; LDraw stud4 uses 16 LDU = 6.4 mm; CMM 6.48", "source": "US 3,005,282 tangency; Lemes 2019" },
    { "id": "tube_inner_diameter", "name": "Underside tube bore (anti-stud)", "nominal_mm": 4.8, "ldraw_ldu": 12, "print_target": { "fdm-0.4": "4.90 to 5.00 printed" }, "confidence": "verified", "note": "equals the stud diameter (patent claim 2)", "source": "US 3,005,282" },
    { "id": "tube_wall", "name": "Underside tube wall", "nominal_mm": 0.857, "ldraw_ldu": 2.1, "print_target": { "fdm-0.4": "at least 0.7 after offsets" }, "confidence": "verified", "note": "(6.514 - 4.8) / 2", "source": "derived" },
    { "id": "pin_1wide_diameter", "name": "Solid pin under 1-wide parts", "nominal_mm": 3.18, "ldraw_ldu": 8, "confidence": "verified", "note": "fractionally less than 8 - 4.8; the 3.18 bar family", "source": "US 3,005,282; Cailliau" },
    { "id": "bar_diameter", "name": "Bar diameter", "nominal_mm": 3.18, "ldraw_ldu": 7.95, "print_target": { "fdm-0.4": "3.14 to 3.26 by coupon" }, "confidence": "verified", "note": "official 3.2 shaft; LDraw models bars at r = 4 LDU", "source": "Cailliau; brickarchitect" },
    { "id": "hollow_stud_bore", "name": "Hollow stud bore / clip opening", "nominal_mm": 3.2, "ldraw_ldu": 8, "print_target": { "fdm-0.4": "3.14 to 3.30 by coupon" }, "confidence": "likely", "note": "3.18 + 2 x 0.01 play", "source": "cfinke/LEGO.scad; LDCad SNAP_CLP default radius 4 LDU" },
    { "id": "technic_hole_diameter", "name": "Technic pin hole", "nominal_mm": 4.8, "ldraw_ldu": 12, "print_target": { "fdm-0.4": "vertical 4.90 to 5.00; horizontal about +0.2 with polyhole/teardrop" }, "confidence": "verified", "note": "about 4.90 measured; same as the tube bore", "source": "Cailliau" },
    { "id": "technic_counterbore_diameter", "name": "Technic counterbore diameter", "nominal_mm": 6.2, "ldraw_ldu": 15.5, "confidence": "likely", "note": "LDraw peghole uses 16 LDU = 6.4; measure", "source": "cfinke/LEGO.scad; PELA; Eurobricks pin collar 0.9 mm" },
    { "id": "technic_counterbore_depth", "name": "Technic counterbore depth", "nominal_mm": 0.9, "ldraw_ldu": 2.25, "confidence": "likely", "note": "LDraw 2 LDU = 0.8", "source": "cfinke/LEGO.scad; Eurobricks" },
    { "id": "technic_hole_axis_height", "name": "Technic hole axis above brick bottom", "nominal_mm": 5.8, "ldraw_ldu": 14.5, "confidence": "likely", "note": "LDraw models 14 LDU = 5.6; 0.2 mm above the system grid so studs fit beneath", "source": "Cailliau; LDraw" },
    { "id": "pin_shaft_diameter", "name": "Technic pin shaft", "nominal_mm": 4.8, "ldraw_ldu": 12, "print_target": { "fdm-0.4": "4.65 to 4.90 by coupon" }, "confidence": "inferred", "note": "friction pins about 4.85 to 4.9 effective; weakest-sourced row; measure", "source": "community lore; measurement program" },
    { "id": "axle_across_tips", "name": "Technic axle cross across tips", "nominal_mm": 4.8, "ldraw_ldu": 12, "print_target": { "fdm-0.4": "4.60 to 4.85 by coupon" }, "confidence": "likely", "note": "about 4.75 measured; turns in a 4.9 round hole", "source": "Cailliau; cfinke/LEGO.scad" },
    { "id": "axle_arm_thickness", "name": "Technic axle arm thickness", "nominal_mm": 1.8, "ldraw_ldu": 4.5, "confidence": "likely", "note": "LDraw simplifies to 4 LDU = 1.6; measure", "source": "community lore; LDraw" },
    { "id": "bush_length", "name": "Technic bush / gear hub length", "nominal_mm": 8.0, "ldraw_ldu": 20, "confidence": "likely", "note": "7.8 on old bushes; 0.1 mm ridges on new", "source": "Cailliau" },
    { "id": "ball_small", "name": "Small ball (towball, Mixel)", "nominal_mm": 5.9, "ldraw_ldu": 14.75, "confidence": "verified", "note": "official 3.2 shaft w/ 5.9 ball; LDraw models r = 8 LDU", "source": "brickarchitect; LDraw" },
    { "id": "ball_large", "name": "Large ball (Technic, CCBS)", "nominal_mm": 10.2, "ldraw_ldu": 25.5, "confidence": "verified", "note": "LDraw socket fits 10.25", "source": "brickarchitect; LDraw" },
    { "id": "click_hinge_detent_deg", "name": "Click hinge detent (degrees)", "nominal_mm": null, "ldraw_ldu": null, "confidence": "likely", "note": "22.5 degree detents, 16 positions; dual fingers about 1.8 mm, single about 2.8 mm", "source": "LDraw clh primitives" },
    { "id": "duplo_scale", "name": "DUPLO-scale factor", "nominal_mm": 2.0, "ldraw_ldu": null, "confidence": "verified", "note": "pitch 16, brick 19.2, stud 9.6 hollow; preschool Mega is not compatible", "source": "US 3,005,282 figure; Wikipedia" },
    { "id": "ldu", "name": "LDraw unit", "nominal_mm": 0.4, "ldraw_ldu": 1, "confidence": "verified", "note": "0.3993 +/- 0.0001 measured", "source": "LDraw spec; LUGNET" }
  ],
  "tolerances": {
    "moulded_machine_um": 10,
    "moulded_mould_um": 20,
    "moulded_rejects_per_million": 18,
    "cmm_genuine_deviation_um": "32 to 41",
    "cmm_clone_deviation_um": "124 to 160",
    "clutch_interference_mm": "0.05 to 0.10 diametral",
    "separation_force_2x4_N": "2.5 to 3 (literature); measure a control on your own rig",
    "note": "The 0.002 mm figure repeated online has no primary source; never quote it."
  }
}
